{
  "artifacts": [
    {
      "path": "eligibility.jsonl",
      "rows": 3392,
      "schemaVersion": "ipl-era-draft-eligibility-row/v1",
      "sha256": "c6a05b88ba36e1e6255b1ed1edd0f888d3d82d014ec3e6dda62c913cd7924438",
      "sizeBytes": 1685393
    },
    {
      "path": "eligibility_review_queue.json",
      "rows": 20,
      "schemaVersion": "ipl-era-draft-eligibility-review/v1",
      "sha256": "1ab370f3663579993dc583b7e85fab431986743271cc192c8b4a8dfdbb0f46a6",
      "sizeBytes": 16039
    }
  ],
  "eligibilityAggregateHash": "08becc0312579ae49eb2ff63edda81ffdb2659c6f3f9e91170bca44b901fa312",
  "eligibilityManifestHash": "b3e6393851e999c23abbc120083b52e8bc444e747d9be7316e0ca73e07be38b6",
  "eligibilityVersion": "ipl-era-draft-eligibility/v1",
  "schemaFiles": [
    {
      "path": "schemas/eligibility.schema.json",
      "rows": null,
      "schemaVersion": "json-schema/2020-12",
      "sha256": "4bdcd9c3c2867b5cb6d6ec321d2055bafb2e993e92153e8977486ff550468605",
      "sizeBytes": 2294
    },
    {
      "path": "schemas/eligibility_manifest.schema.json",
      "rows": null,
      "schemaVersion": "json-schema/2020-12",
      "sha256": "a2c270ec7c65f4b2bd50b10cfaabb0ba761db91153c4439f8f1ead15da93a4c7",
      "sizeBytes": 3171
    },
    {
      "path": "schemas/eligibility_review_queue.schema.json",
      "rows": null,
      "schemaVersion": "json-schema/2020-12",
      "sha256": "9916f38570f79b575bfee96b18f44bc08b99bb32bc4ac7db62873e92dfb5f925",
      "sizeBytes": 6545
    },
    {
      "path": "schemas/validation_report.schema.json",
      "rows": null,
      "schemaVersion": "json-schema/2020-12",
      "sha256": "be6a6b220bedc274a99a4daea97fbd3b193a768e1870cb6b11586828ab4b65fc",
      "sizeBytes": 3926
    }
  ],
  "schemaVersion": "ipl-era-draft-eligibility-manifest/v1",
  "stage4AnalyticalManifestHash": "f437d9e03c1f1749b5a0b8b8c06a41e80c8f2d18e3d43d791b054014acf5998c",
  "stage4DatasetVersion": "cricsheet-ipl-analytics/v1",
  "wicketkeeperMetadataManifestHash": "6dd387a4a32103273568dcf9eb8949c4e426bf309ea809372f767f89a0169a59",
  "wicketkeeperMetadataVersion": "ipl-wicketkeeper-metadata/v1"
}
